{"$id":"QK_GBFP8_HEAD64_GRANULARITY_SWEEP_EXECUTION_V15_SHELLFREE_FRESH_L2_ACCEPTANCE_SCHEMA","$schema":"https://json-schema.org/draft/2020-12/schema","additionalProperties":false,"properties":{"acceptance_sha256":{"pattern":"^[0-9a-f]{64}$","type":"string"},"action_id":{"const":"ace2:qk-gbfp8-base-v15:execute-once:c2dfe170:20260814T084500Z"},"artifact_kind":{"const":"qk_gbfp8_head64_granularity_sweep_execution_v15_shellfree_fresh_l2_static_acceptance"},"decision":{"const":"ACCEPT_STATIC_PACKAGE"},"execution_package_file_sha256":{"pattern":"^[0-9a-f]{64}$","type":"string"},"independent_verifier_rerun_sha256":{"pattern":"^[0-9a-f]{64}$","type":"string"},"reviewer_decision_sha256":{"pattern":"^[0-9a-f]{64}$","type":"string"},"reviewer_role":{"const":"Fresh-L2"},"reviewer_thread_id":{"minLength":1,"type":"string"},"static_acceptance_grants_execution_authority":{"const":false},"target_process_starts":{"const":0}},"required":["acceptance_sha256","action_id","artifact_kind","decision","execution_package_file_sha256","independent_verifier_rerun_sha256","reviewer_decision_sha256","reviewer_role","reviewer_thread_id","static_acceptance_grants_execution_authority","target_process_starts"],"type":"object"}
