{"acceptance_sha256":"9536a7180a884c5aec9f05fe5fe045cd08378be5041286a4369f1e07ad52ac22","action_id":"ace2:qk-gbfp8-base-v15:execute-once:c2dfe170:20260814T084500Z","artifact_kind":"qk_gbfp8_head64_granularity_sweep_execution_v15_shellfree_fresh_l2_static_acceptance","decision":"ACCEPT_STATIC_PACKAGE","execution_package_file_sha256":"e53777f220db67702c5886112a262bde84e262b6b2e0bb5b817ae61a1f611dd3","independent_verifier_rerun_sha256":"7d9ad7701ec339f1031c8e2d3738aca54997a553e040759ef2a6d9e6a01e162c","reviewer_decision_sha256":"b046dfc3bf51b8d5439a3d548f589b885223b2c3c3169467a7aeec01be410e04","reviewer_role":"Fresh-L2","reviewer_thread_id":"019fff74-7b6e-7ce0-8dcd-f2df7f516c1c","static_acceptance_grants_execution_authority":false,"target_process_starts":0}
